orth,translation
VENDREDI TEMPS ENCORE VARIABLE SAMEDI BEAUCOUP IX BEAU,vendredi encore variable mais samedi agréable en de nombreux endroits
SUD NORD-EST POSSIBLE LIEU PLUIE ENCORE,"au nord et à l'est, il pleut encore dans certaines régions"
CHER ASSISTANT poss-BONNE SOIREE,"Chers téléspectateurs, bonsoir"
SOURCE NUAGE CE MIDI PROBABLEMENT MONTRER-ECRAN DEJA VENIR ORAGE OUEST DEJA VENIR,"des nuages en forme de tour dans le ciel, appelés aussi castellani, sont les signes avant-coureurs d'orages qui ont déjà éclaté à l'ouest"
POSSIBLE PLUIE VENT GRELE AUSSI TEMPETE OURAGAN PEUVENT,"Cela signifie qu'ils peuvent apporter de fortes pluies, des rafales de vent, de la grêle et, dans certains cas, des tornades."
POINT DIFFICILE OÙ REGION OUEST REGION SUEDWEST REGION EST REGION SECHE poss-SEIN,"cette nuit, le centre de gravité se situe principalement dans l'ouest sud-ouest dans l'est, le temps reste encore sec"
NORD-OUEST PLUIE PARFOIS CONTINUE VENT PRES DE LA COTE,"au nord-ouest, pluie parfois permanente et vent tempétueux sur la côte"
VOUS SOUHAITEZ SAVOIR ACTUALISER INFORMER ALERTE POUVOIR MONTRER-ECRAN,"si vous souhaitez obtenir des informations actualisées sur les alertes météo, vous pouvez le faire à tout moment via le texte de zdf et sur internet"
DEMAIN AUSSI ORAGES REGION SUD REGION OUEST DEJA PLUS FRAIS,"de l'air chaud et humide apportera encore demain ces orages dans l'est et le sud-est, alors qu'il fait déjà nettement plus frais dans l'ouest"
AU COURS DU WEEK-END CALME PLUS AGREABLE SOLEIL,Mais la fin de semaine sera plus calme et surtout plus agréable.
DONC IN-KOMMEND TOUS BIEN,passez une bonne nuit d'orage
TSCHUESS,au revoir
MAINTENANT TEMPS COMMENT-APPARAITRE DEMAIN MERCREDI SIX VINGT MAI,et maintenant les prévisions météo pour demain mercredi 26 mai
ALLEMAGNE SUD HUMIDE CHAUD NORD FROID MAIS SEC,sur le sud de l'allemagne se trouve une masse d'air chaud et humide sur le nord une masse d'air frais mais assez sec.
SUD CETTE NUIT AVERSES ORAGEUSES SURTOUT RHENANIE-PALATINAT ET SUD,"dans la nuit, des averses et des orages se produiront dans la moitié sud, surtout entre la rhénanie-Palatinat et la france"
JOURNEE AUSSI PLUIE AUSSI ORAGES NORD DEBUT AGREABLE EN COURS APRES MIDI AUSSI PLUIE,"dans la journée également, il pleut fortement dans certaines régions de la moitié sud, avec parfois des orages vers le nord, le temps est d'abord généralement agréable ce n'est que dans l'après-midi qu'il pleut ici et là"
VENT FAIBLE FAIBLE VENANT DU SUD VENANT SI ORAGE AVEC TEMPETE,"le vent est faible à modéré dans le sud, parfois frais en cas d'orages, des rafales de vent sont possibles"
DEMAIN QUATORZE IX NORD REGION MAXIMUM QUATRE VINGT,"le jour, treize degrés à la mer du Nord jusqu'à vingt-quatre degrés au lac de Constance"
JEUDI TEMPS VARIABLE SUD-EST ORAGES,jeudi temps variable dans la moitié sud-est quelques orages
VENDREDI AGREABLE SEULEMENT QUELQUES AVERSES,"vendredi, le temps est assez agréable avec quelques averses ici et là"
SAMEDI AUSSI REGION AGREABLE SUD NORD-OUEST QUELQUES AVERSES,"samedi, le temps est également assez agréable dans le sud et le nord-ouest avec quelques averses."
MAINTENANT TEMPS COMMENT-APPARAITRE DEMAIN DIMANCHE TROISIEME AOÛT,"et maintenant les prévisions météo pour demain, dimanche 3 octobre"
RUSSIE IX FORT VENIR INFLUENCE poss-MEIN REGION,L'anticyclone au-dessus de la Russie exerce à nouveau une influence plus forte sur notre temps en Allemagne
NORD NUAGE ENCORE NORD,"au nord, les nuages des basses couches de l'Atlantique se font encore sentir"
"CETTE NUIT, NUAGES, EPAIS, NORD-OUEST, PLUIE LA PLUPART DU TEMPS.","cette nuit, les nuages sont plus ou moins proches les uns des autres, surtout dans le nord-ouest où il pleut par endroits"
SUD UN PEU DE BROUILLARD,"dans le sud, du brouillard se forme ici et là"
DEMAIN SUD-EST GENERALEMENT SOLEIL UN PEU D'ECLAIRCIE MAIS DES NUAGES ET DE LA PLUIE EN PLUS,"demain, le soleil brillera souvent dans la moitié sud-est du pays vers le nord-ouest quelques éclaircies mais aussi des champs nuageux denses et parfois un peu de pluie"
VENT FAIBLE TEMPETE IX TEMPETE,"le vent est faible à modéré au nord et à l'ouest, parfois frais avec de fortes rafales à la mer"
CETTE NUIT QUATORZE COELN REGION ET ALPEN QUATRE,"cette nuit, quatorze degrés dans la baie de Cologne à quatre degrés au pied des Alpes"
DEMAIN RUEGEN QUINZE CINQ VINGT SUD-OUEST,"le jour, quinze degrés à Rügen et jusqu'à vingt-cinq degrés dans le sud-ouest"
LUNDI BROUILLARD PUIS TEMPS AGREABLE SEC,"lundi : d'abord du brouillard, puis un temps sec et agréable"
MARDI NORD RESTER,peu de changement mardi dans la moitié nord du pays
SUD NUAGEUX PARTIE PLUIE,"en direction du sud, le ciel est plus nuageux et il pleut par endroits"
MERCREDI SOLEIL NUAGE BROUILLARD,"mercredi, soleil, nuages et brouillard"
MAIS RESTER SEC,le temps reste sec
EUROPE MILIEU REGION HAUT VENIR IX BAS VENIR,le centre de l'europe est entouré d'un vaste haut autour duquel les bas font un large arc de cercle
CETTE NUIT CLAIR ETOILES PEUVENT VOIR SEC MAINTENANT ENCORE NUAGE NUIT DISPARAITRE BROUILLARD SEULEMENT IX,"cette nuit, le temps est clair et sec la plupart des nuages qui sont encore en route se dissiperont au cours de la nuit le brouillard ne se forme que par endroits"
TOUTE LA JOURNEE PUIS LA PLUPART DU TEMPS SOLEIL NORD EST REGION MONTAGNE NUAGE PEUVENT MAIS SEC,"en journée, beaucoup de soleil dans le nord et l'est ainsi que sur les montagnes du sud de l'Allemagne, le temps est parfois nuageux mais sec"
VENT VENT,"le vent vient du sud-est et souffle faiblement vers le nord-est, parfois modérément"
CETTE NUIT HUIT A UN DEGRE REGION MOINS UN DEGRE,"cette nuit, températures entre huit et un degré dans les Alpes moins un degré"
TOUTE LA JOURNEE SEIZE DEGRES NORD REGION JUSQU'A QUATRE VINGT DEGRES,le jour seize degrés sur la mer Baltique dans le Rhin supérieur jusqu'à vingt-quatre degrés
COMMENT-APPARAITRE A L'ARRIVEE MERCREDI ET JEUDI LA PLUPART DU TEMPS SOLEIL S0NNE SOLEIL IX NUAGE UN PEU AVERSE ORAGE PEUT ETRE,les perspectives mercredi et jeudi beaucoup de soleil ici et là des nuages isolés il faut s'attendre à des averses ou des orages
VENDREDI COMME TOUJOURS COMME TOUJOURS COMME TOUJOURS LA PLUPART DES MONTAGNES CHANGENT AVERSES ORAGES,"Vendredi, peu de changements, au mieux quelques averses ou orages sur les montagnes."
COMMENT-APPARAITRE DEMAIN LUNDI PREMIER FEVRIER,"et voici les prévisions météo pour demain, lundi 1er février"
CE-EST-IL MONTRER-ECRAN LUNDI DEBUT BEAUCOUP CHANGEANT FROID FROID,la nouvelle semaine commence par un temps variable et un froid hivernal
DEMAIN SOIR RESTER BAS VENIR REGION IX CONTINUER NEIGE NEIGE,la dépression qui se déplace jusqu'à demain soir sur le nord de l'Allemagne vers le sud de la mer Baltique provoque de nouvelles chutes de neige
NUIT NEIGE AVERSES IX AUSSI NEIGE PLUIE,"dans la nuit, il y aura des averses de neige en direction de la mer du Nord, ainsi que de la neige."
SUED PLUS CLAIR,"le ciel s'éclaircit parfois, surtout dans le sud"
JOUR MATIN NEIGE NEIGE NORD-OUEST AUSSI ORAGE NEIGE PLUIE GRESIL PLUS TARD NORD-OUEST CLAIR,"en journée, il neige dans certaines régions vers le nord-ouest, avec des averses orageuses de neige ou de grésil plus tard, le ciel se dégage au nord-ouest"
VENT FAIBLE MODERE BAS VENTS IX MONTAGNE IX FORT TEMPETE,le vent est modéré à frais en cas d'averses et fort à tempétueux en montagne
NUIT ZERO IX SUD ALPES MOINS QUATORZE,"dans la nuit, les températures varient entre zéro degré à la mer du Nord et jusqu'à moins quatorze degrés au pied des Alpes"
PRUDENCE ATTENTION VERGLAS,attention au verglas
MARDI NORD-OUEST PRINCIPALEMENT NEIGE NEIGE REGION NORD-OUEST EN COURS PLUIE,"mardi, fortes chutes de neige à partir du nord-ouest qui se transformeront ensuite en pluie, surtout dans le nord-ouest et l'ouest"
MER NORD TEMPETE,rafales de vent en montagne et dans le nord
MAINTENANT TEMPS COMMENT-APPARAITRE DEMAIN LUNDI TROIS VINGT AOÛT,et maintenant les prévisions météorologiques pour demain lundi vingt-trois août
SCANDINAVIE IX BASSE ANGLETERRE BASSE DIRECTION DANEMARK JUSQU'A CETTE NUIT DEMAIN AINSI METEO IX SUITE AINSI,la dépression sur la Scandinavie et une dépression qui se déplace de la Grande-Bretagne vers le Danemark déterminent le temps de la nuit et de demain
D'ABORD CHAUD VIENT PLUS TARD FRAIS,"de l'air chaud nous arrive encore, puis de l'air plus frais"
DEMAIN INTEMPERIES ORAGE TU T'ATTENDS A PRINCIPALEMENT PLUIE GRELE,"cette nuit, il faut s'attendre dans certaines régions à des orages intempestifs avec de fortes pluies et de la grêle"
DEJA ALLEMAND IX WETTER SERVICE AVERTISSEMENT,les avertissements correspondants du service météorologique allemand s'appliquent
FLEUVE SUD SEULEMENT PROBABLEMENT AVERSES ORAGES,"au sud du danube, seulement des averses et des orages ici et là"
CETTE NUIT DIX-NEUF ENTRE QUINZE BAVIERE EST BAVIERE IX TREIZE MAXIMUM,cette nuit dix-neuf à quinze degrés dans l'est de la Bavière jusqu'à treize degrés
JOUR SYLT IX TREIZE RIVIERE IX MAXIMUM NEUF VINGT DEGRES,"le jour, dix-huit degrés sur l'île de sylt jusqu'à vingt-neuf degrés sur le Danube"
MARDI SUD ENCORE PLUIE ORAGE IX AUSSI AVERSES IX VENT PARTICULIER,"mardi, pluie et orages isolés dans le sud, averses sur les côtes avec beaucoup de vent."
SINON REGION AGREABLE,sinon c'est en partie amical
MERCREDI SEULEMENT NORD AVERSES ORAGE JEUDI MEME SUD PLUS AGREABLE,"mercredi, averses et orages isolés uniquement dans le nord jeudi, le temps est également agréable en direction du sud"
MAINTENANT TEMPS DEMAIN SAMEDI TROISIEME OCTOBRE,"et maintenant les prévisions météo pour demain, samedi 3 octobre"
TEMPETE BASSE NORD MER VENIR,une dépression orageuse se dirige vers la mer du nord
DONC WEEK-END REGION NORD MILIEU MONTAGNE TEMPETE,Il provoque des tempêtes dans le nord de l'Allemagne et dans les montagnes moyennes ce week-end.
TEMPS AUSSI DEMAIN NORD REGION PLUIE REGION CHANGEANT SUD REGION PRINCIPALEMENT SOLEIL D'ABORD BROUILLARD,"le soleil et les nuages au sud, le temps est généralement ensoleillé dès que le brouillard disparaît."
VENT DU SUD FAIBLE NORD FORT VENT POSSIBLE REGION NORD OURAGAN,"dans le sud, le vent est faible à modéré dans le nord, il est frais à fort avec des rafales de vent en mer du nord et sur les sommets des montagnes moyennes, des rafales d'ouragan sont possibles."
CETTE NUIT DIX A UN DEGRE REGION SIGNIFIE DEUX DEJA GEL AU SOL,"cette nuit, dix à un degré dans les vallées du sud de l'allemagne, gelée locale au sol"
DEMAIN NORD REGION TREIZE DEGRES REGION DEUX DEGRES,le jour treize degrés dans le nord-est jusqu'à vingt degrés dans le breisgau
DIMANCHE PLUIE PARTIELLE REGION NORD MILIEU MONTAGNE ENCORE TEMPETE,"dimanche, il y aura des averses par endroits dans le nord et le temps sera encore orageux au-dessus des moyennes montagnes"
MARDI VARIABLE NUAGE SOLEIL PLUIE,"mardi, le temps reste variable avec du soleil, des nuages et de la pluie"
MAIS FROID CHAUD BLANC négligé,mais il fait assez doux
BONNE soirée CHER ASSISTANT poss-EUCH,bonsoir chers spectateurs
AU MILIEU DE LA MONTAGNE ENCORE BEAUCOUP DE NEIGE SKI EPAIS LUGE AUJOURD'HUI EN PLUS SOLEIL EXEMPLE,"dans les montagnes moyennes, il y a encore suffisamment de neige pour faire du ski ou de la luge et en plus, il y avait du soleil aujourd'hui, comme ici dans les montagnes de l'egge, un temps magnifique."
BEAU TEMPS VUE AUSSI POUR PLUS DESCENDRE LENTEMENT BIEN QU'IN-KOMMEND QUAND MEME UN PEU DE PLUIE VENIR,"et c'est aussi bon pour le niveau des rivières qui peuvent ainsi baisser lentement, même si nous attendons encore un peu de pluie demain."
SEULEMENT L'OUEST DEPLACE BEAUCOUP DE PLUIE PAS NEG-HABEN NEG-HABEN,"cette zone de pluie ne nous atteint que dans l'ouest et s'affaiblit de plus en plus, ce qui signifie qu'il ne faut pas s'attendre à beaucoup de pluie dans un premier temps."
MERCREDI JEUDI PUIS NOUVELLE PLUIE VENIR DEMAIN D'ABORD VENIR,"Mercredi jeudi, de nouvelles pluies massives atteindront l'Irlande demain."
CE SOIR FROID HUMIDE ET BROUILLARD,"ce soir, le froid sera surtout glacial l'air sera aussi humide et il y aura aussi du brouillard"
DEMAIN MATIN VOITURE GRATTAGE DE GLACE,"et demain matin, du givre sur les vitres de la voiture que vous pourrez gratter."
PUIS EN JOURNEE GELEE LIBRE NORD AUTOUR DE UN A TROIS DEGRES SUD-OUEST PARTICULIEREMENT DOUX SIX A HUIT DEGRES,"mais pendant la journée, il ne gèlera pas, même dans le nord de l'Allemagne, où il fera un à trois degrés, et dans le sud-ouest, où il fera six à huit degrés."
TEMPS CHANGEANT,et le temps peut varier considérablement
UN COTE SOLEIL AUTRE BRUME SOURCE NUAGE APRES MIDI NUAGE VENIR ET UN PEU PLUIE PUIS UN PEU NEIGE MILIEU MONTAGNE FORTE,"Le soleil brille d'une part, et d'autre part, nous avons un épais brouillard et dans l'après-midi, des nuages épais et comme je l'ai dit, un peu de pluie, peut-être un peu de neige, au moins en moyenne montagne, et le vent devient également un peu plus fort."
PUIS MONTEE DE LA RAISON DEPUIS MILIEU DE LA MONTAGNE NEIGE DEGEL JUSQU'A QUATORZE DEGRES TEMPERATURE IX,"Cela va probablement aggraver la situation des inondations, car la neige va fondre dans les montagnes moyennes avec des températures allant jusqu'à 14 degrés."
BONNES SOIRS BONS POSSIBILITES,je vous souhaite une bonne soirée et prenez soin de vous
MAINTENANT TEMPS DEMAIN MARDI VINGT AVRIL COMMENT-APPARAITRE,et maintenant les prévisions météo pour demain mardi 20 avril
ALLEMAGNE PAYS NORD PRESSION REGION,le nord de l'allemagne sous l'influence des basses pressions
NUAGE PEUVENT VENIR PLUIE,et c'est ainsi qu'apparaissent des nuages parfois plus denses qui apportent ici et là de la pluie
ISLANDE REGION AUSSI FROID VENIR TEMPERATURE BAISSER CHUTER,Une vague d'air frais en provenance d'Islande fait baisser les températures.
CETTE NUIT NUAGE PLUS NUAGE CLAIR SEC,"cette nuit, le ciel est nuageux ici et là, mais généralement clair et sec"
DEMAIN MATIN NUAGEUX NORD NUAGEUX PEUVENT PLEUVOIR,"au petit matin, des nuages plus denses avec quelques pluies atteignent la côte de la mer du nord"
DEMAIN NUAGEUX IX SEUL PLUIE POUVOIR,ces nuages s'étendront demain sur le nord et il pleuvra dans certaines régions
SUD D'ABORD SOLEIL PLUS TARD REGION PEUT PLEUVOIR SPECIALEMENT SUD AUSSI ORAGES,"dans le reste du pays, il y a d'abord plus de soleil que de nuages, puis quelques averses, surtout vers le sud-est où des orages sont possibles."
VENT REGION MODERE FAIBLE NORD PEUVENT ETRE FRAIS REGION SOUFFLENT,vent d'ouest faible à modéré au nord-ouest et parfois frais près des averses
NORD PEUVENT TEMPERATURE GEL REGION SEPT DEGRES,"au nord, sous un ciel dégagé, léger gel cette nuit sur l'isar jusqu'à sept degrés plus"
DEMAIN SEPT DEGRES NORD BAS DIX-NEUF DEGRES,"demain, les températures iront de sept degrés à la frontière danoise à dix-neuf degrés dans le Brisgau"
EN-VENANT AUSSI LA NUIT SI CIEL POSSIBLE GEL,il faut s'attendre à du gel sous un ciel dégagé dans les prochains jours
JOUR EST VENT VARIABLE SUD PUIS AGREABLE,"pendant la journée, vent et temps variable dans la moitié nord-est, mais aussi longtemps agréable vers le sud-ouest"
MAINTENANT TEMPS DEMAIN MARDI SEPT VINGT OCTOBRE,"et maintenant les prévisions météorologiques pour demain, mardi vingt-sept octobre"
ALLEMAND PAYS NORD EST BAS PRESSION VENIR,la moitié nord-est de l'allemagne reste sous l'influence d'une dépression et de nuages
SUD OUEST VENIR HAUT PRESSION VENIR EN COURS CALME AUSSI PARTIE REGION AGREABLE AUTOMNE,"mais une pression atmosphérique de plus en plus élevée s'étend à partir du sud-ouest, de sorte que nous pouvons nous attendre à un temps automnal calme et partiellement agréable dans les prochains jours."
SUD-OUEST NUAGE TROU AUSSI BROUILLARD,"en direction du sud-ouest, il y a ici et là des trouées dans les nuages et parfois du brouillard"
DEMAIN SUEDWEST IX ONT PARTIE REGION SOLEIL,"demain, le soleil se montrera dans certaines régions de la moitié sud-ouest"
REGION NUAGE PLUIE,"sinon, le ciel reste généralement nuageux avec quelques averses ou un peu de bruine"
NORD-EST FAIBLE MESURE IX VENTS IX VENTS SINON REGION DIFFERENCE VENTS IX ALLGAEU,"dans la moitié nord-est, le vent est faible à modéré et souffle de l'ouest au nord-ouest. ailleurs, il souffle dans différentes directions."
CETTE NUIT DEUX NORD MAXIMUM ONZE,deux degrés cette nuit dans l'Allgäu à onze degrés dans le nord
DEMAIN DIX DEGRES OISEAU PAYS IX MAXIMUM SEIZE DEGRES,"demain, les températures iront de dix degrés dans le Vogtland à seize degrés dans le Rhin supérieur"
MERCREDI JEUDI SUD-OUEST BROUILLARD PARTIE REGION LÂCHE UN PEU DE SOLEIL,"mercredi et jeudi dans la moitié sud-ouest du pays, en partie brumeux, en partie clairsemé avec du soleil"
MAINTENANT TEMPS COMMENT-APPARAITRE DEMAIN DIMANCHE QUATORZE AOÛT,"et maintenant les prévisions météo pour demain, dimanche 14 août"
NUIT NUAGE CIEL CLAIR VARIABLE NORD-OUEST NUAGE EPAIS VENIR ORAGES,"cette nuit, le temps est en partie nuageux et en partie clair dans le nord-ouest et l'ouest, la nébulosité s'épaissit vers demain et des averses orageuses sont attendues"
EST SUD-EST DEBUT JOUR DEBUT AGREABLE OUEST ARRIVENT DEJA PLUIE ORAGES ARRIVENT,"dans l'est et le sud, le début de journée est encore agréable tandis que des averses et des orages parfois violents se propagent à partir de l'ouest"
NUIT ONZE A SEIZE FLEUVE DIX-SEPT A DIX-HUIT DEGRES,dans la nuit de onze à seize sur le Rhin et le Main de dix-sept à dix-huit degrés
LUNDI SPECIAL EST SUD-EST ENCORE DES ORAGES PLUIE PEUVENT NORD-OUEST NUAGE SE DEPLACER AVERSES,"lundi, en particulier dans l'est et le sud-est, encore des pluies parfois orageuses sinon plus ou moins de nuages et averses isolées"
MARDI REGION PLUS AGREABLE,"mardi, le temps sera agréable sur une grande partie du territoire"
MERCREDI AUSSI EST SUD-EST RESTE AGREABLE,"mercredi, c'est encore valable pour l'est et le sud"
NORD-OUEST A NOUVEAU DES NUAGES PEUVENT PROVOQUER DES AVERSES,"dans le nord-ouest, à nouveau des nuages avec des averses isolées"
ICI METEO COMMENT-APPARAITRE DEMAIN LUNDI SEIZE NOVEMBRE,et maintenant les prévisions météorologiques pour demain lundi 16 novembre
SINON PLUIE REGION AVANT MM OUEST PLUIE PARFOIS SOLEIL,"sinon, les pluies parfois fortes se propagent vers la Poméranie occidentale, avec de fortes averses et aussi des éclaircies"
JOUR VENT VENT REGION FORT VENT COMME TEMPETE POSSIBLE,"le jour, le vent souffle fraîchement au nord-ouest où il peut atteindre la force d'une rafale ou d'une tempête"
CETTE NUIT PEUT NORD DIX SUD QUATRE,"cette nuit, dix degrés dans la Frise du nord à quatre degrés tout au sud-est"
JOUR QUATRE NEUF NORD MAXIMUM SEIZE SUD-OUEST,neuf degrés en journée sur la mer Baltique et jusqu'à seize degrés dans le sud-ouest
MERCREDI NUAGE PLUS PEU NUAGEUX ET PLUIE AVEC VENT,"mercredi, les nuages sont plus ou moins denses et il pleut dans certaines régions avec du vent"
JEUDI PLUIE VENT NORD REGION AGREABLE,jeudi pluie et vent dans le nord dans le sud le temps est assez agréable
BASSE PRESSION SUD ITALIE VENIR PLUS BEAUCOUP NUAGE PLUS PLUIE NORD GELER PLUIE PLUS PAYS TOTAL NEIGE BRILLER,la dépression qui se déplace vers le nord de l'Italie nous apporte des nuages épais et des précipitations qui se transforment progressivement en neige sur tout le pays par des pluies verglaçantes venant du nord
DONC AVERTISSEMENT DU SERVICE METEO ALLEMAND,les alertes météorologiques correspondantes du service météorologique allemand sont valables
CE SOIR NORD NORD-OUEST PARTIE PRINCIPALEMENT NEIGE SINON REGION PEU PLUIE GEL PLUIE CENTRE REGION PLUS CHANGER NEIGE,"cette nuit, il faut s'attendre à de fortes chutes de neige dans le nord et le nord-ouest, sinon ici et là de la pluie ou de la pluie verglaçante qui se transformera en neige dans le milieu au cours de la nuit"
VIGILANCE GLATT,attention au verglas
JOUR PLUS DE NEIGE SEMBLE SUD-EST PLUS DE PLUIE PEU POSSIBLE GELER SOIR PRINCIPALEMENT CHANGER DE NEIGE,"dans la journée, nouvelles chutes de neige dans le sud-est, d'abord encore de la pluie qui gèle localement puis se transforme en fortes chutes de neige jusqu'en soirée"
VENT MODERE FAIBLE VENT NORD PEU TEMPETE COTE VENT PEU NEIGE SEMBLENT SOUFFLER,"le vent est faible à modéré dans le nord, frais avec des rafales de vent en mer où il y a encore parfois des congères de neige"
CE SOIR PLUS TROIS REGION MOINS QUATRE DEGRES REGION,cette nuit plus trois degrés dans le breisgau sinon deux à moins quatre degrés
JOUR PLUS QUATRE SUD-EST MOINS TROIS F REGION ET MONTAGNE IX,"en journée, plus quatre degrés dans le sud-est et moins trois degrés à Flensbourg et dans l'Eifel"
SAMEDI SUD-EST PLUS NORD-OUEST PEU AGREABLE REGION PEU,"samedi, nouvelles chutes de neige dans la moitié sud-est, mais aussi des passages agréables dans la moitié nord-ouest"
DIMANCHE LUNDI PARTIE SOLEIL PARTIE NUAGE PLUS SEC,"dimanche et lundi : soleil et nuages, temps sec en général"
SOIR CHER SPECTATEUR SALUER,bonsoir chers spectateurs
OUEST A NOUVEAU DEBUT PLUIE MOUILLEE VENIR,le temps redevient humide l'ouest a recommencé à pleuvoir
PUIS NORD BAS DONC NUAGE,et cette basse altitude au-dessus de la mer du Nord qui nous amène ce front nuageux
MAINTENANT NUAGE ALLEMAND PAYS VENIR,elle va maintenant presque traverser l'allemagne pas tout à fait
REGION EST ENCORE SECHE ET CHAUDE IX,"dans l'est, le temps restera encore largement sec et chaud demain"
MAIS OUEST PRINCIPALEMENT FROID IX,"mais dans l'ouest, il fera un peu plus frais."
PLUIE CETTE NUIT REGION VENIR ET A PARTIR DE DOUZE HEURES DUREE PAYS ACIDE RHENANIE-WESTPHALIE ROUGE CHEVEUX MONTAGNE PLUIE VIOLENTE,je suis très contente de ce que j'ai vu et de ce que j'ai entendu. je suis très contente de ce que j'ai vu et de ce que j'ai entendu. je suis très contente de ce que j'ai vu et de ce que j'ai entendu.
SINON REGION IX SUD SEC,"sinon, le temps reste encore sec à l'est et au sud"
PUIS DEMAIN PLUIE FLEUVE IX EST LAC PLUIE,"demain matin, il continuera à pleuvoir par intermittence avec des averses de la Sarre à la côte de la mer Baltique"
EST SUD UN PEU DE SOLEIL APRES MIDI IX AUSSI NUAGEUX,"dans l'est et le sud, le soleil peut encore briller par moments, mais l'après-midi, les nuages deviennent plus denses dans ces régions également"
QUELQUES AVERSES ORAGEUSES,il y a quelques averses et orages
IX CENTRE PAYS ALLEMAND IX PROBABLEMENT COUVERT PLUIE MAIS NORD A NOUVEAU CLAIR,"Le temps est toujours aussi maussade et pluvieux dans le centre de l'Allemagne, mais il s'éclaircit à la mer du Nord."
PROBABLEMENT SOLEIL NUAGE PLUS AGREABLE,le soleil et les nuages se succèdent et le temps devient plus agréable
IX AUSSI VENT FAIBLE IX VENTS,et il n'y a qu'un faible vent de sud à sud-ouest.
SINON PLUS FRAIS ENVIRON VINGT TROIS VINGT DEGRES,"mais sinon, il fait un peu plus frais qu'aujourd'hui, avec vingt à vingt-trois degrés"
JEUDI EST REGION SUD PLUIE,oui jeudi un jour de pluie à l'est et au sud
PUIS AUSSI IN-KOMMEND MOUILLE PEUT-ETRE SAMEDI ALPES IX CRUES,"et les prochains jours seront plutôt humides, peut-être samedi dans les Alpes avec des crues."
FAIRE BONNE SOIREE BIEN SOUHAITER,je vous souhaite une bonne soirée et prenez soin de vous
BONNE SOIREE,"Chers téléspectateurs, bonsoir"
DEJA HIER SOIR NEIGE REGION OUEST ET EST ENORMEMENT FROID,"depuis hier, il a neigé, parfois abondamment, dans la moitié ouest du pays, tandis que le nord-est est toujours sous l'emprise du froid arctique."
NEIGE CETTE NUIT EN COURS DE ROUTE LES ALPES AUSSI NEIGE MOINS,"Les chutes de neige se retireront progressivement vers les Alpes au cours de la nuit et demain, et diminueront également."
CETTE NUIT REGION NORD CIEL CLAIR ENORME FROID DIRE COMME GELER ARMOIRE MOINS DIX-HUIT DEGRES,"Ce soir, le ciel s'éclaircira partiellement dans le nord, puis nous retournerons vraiment au congélateur, on peut presque dire jusqu'à moins dix-huit degrés."
REGION ELF GRAD IX MINUS IX nég-FROID FROID OUI ENORMEMENT FROID REGION NEGALP-AUCH,températures négatives à deux chiffres sur une grande partie du territoire.
DEMAIN REGION NORD SOLEIL CIEL JUSQU'A PRESENT JANVIER SOLEIL PEU,"Je suis très content que tu sois là, et que tu aies réussi à faire la différence."
MAIS ENORME VENT FORT VENTS AUSSI REGION CENTRE PARTIE SOLEIL,mais avec un fort vent d'est-nord-est et le temps sera encore partiellement agréable dans le centre.
REGION SUEDWEST ZERO FROID NEGALP-AUCH MOINS DE TROIS DEGRES,"dans le sud et le sud-ouest, il fait moins trois à plus un degré"
REGION NORD AUSSI DEMAIN JOUR MOINS DIX PEUT,"dans le nord-est, des températures négatives à deux chiffres persistent en partie pendant la journée"
LUNDI MERCREDI AH MERCREDI REGION NORD NEIGE VENIR DEBUT D'ABORD PLUIE PUIS CHANGER NEIGE FROID,"jeudi et mercredi, de nouvelles chutes de neige arriveront du nord-ouest."
JEUDI PARTICULIEREMENT TEMPETE POSSIBLE NEIGE FORTE PLUS CHAUD,"à partir de jeudi, tempête, parfois fortes averses de neige, un peu plus doux"
MAIS RESTER FROID ET NEIGEUX,mais toujours assez froid pour qu'il neige
J'ESPERE QUE VOUS AIMEZ LA NEIGE,alors j'espère que vous aimez la neige
JE VOUS SOUHAITE UNE BONNE SOIREE,je vous souhaite une bonne soirée
SOIR CHER SPECTATEUR,bonsoir chers spectateurs
POUVOIR CONDUIRE UNE VOITURE,La conduite automobile peut maintenant devenir une glissade
AUJOURD'HUI APRES MIDI DEJA DE LA PLUIE MAINTENANT LE SOIR FRAIS REGION OUEST PAYS POUVOIR,"Cet après-midi déjà, nous avons eu de la pluie et maintenant, dans la soirée, nous en avons aussi dans l'ouest."
PLUS AU NORD VIENNENT CE SOIR NEIGE PEUVENT AVOIR DEMAIN COTE CHANGENT PLUIE,"le vent continue à se déplacer vers le nord, il y neigera partiellement cette nuit demain encore au début sur les côtes, puis ce sera de la pluie"
