orth,translation
DANS L'ENSEMBLE ORAGES MOINS ENCORE AVERSES TEMPERATURE MAXIMALE VINGT DEGRES,"Les jours suivants, il y aura moins d'orages mais toujours des averses et des températures maximales de 20 degrés."
SI TU VEUX SAVOIR EXACTEMENT CE QU'EST UN MAUVAIS TEMPS TU PEUX TOUJOURS LIRE SUR INTERNET Z+D+F TEXTE IX OU W+E METEO Z+D+F POINT D+E,"si vous souhaitez être informé des alertes météo, vous pouvez le faire à tout moment sur notre site internet en consultant le texte de zdf ou en vous rendant sur le site wetter zdf punkt d e."
SOUHAITER UNE SOIREE AGREABLE,Je vous souhaite une bonne soirée.
BONNE SOIREE CHER SPECTATEUR,bonsoir chers spectateurs
METEO AUJOURD'HUI PLUS GRIS AUJOURD'HUI BLEU CIEL WUERZ BURG DEMAIN MERCREDI RIEN NEGATIF,"je suis très contente de mon séjour à Würzburg, j'ai eu beaucoup de plaisir à y passer la journée et j'en suis très satisfaite."
MAIS IX WUERZ BURG NEIGE NEIGE,mais il n'y a pas de neige non plus
IX ALLEMAGNE PAYS RAREMENT IX,la neige est une denrée rare chez nous en allemagne mais nous en avons un peu quand même
MAIS UN PEU DE PLUIE SEULEMENT NORD KIEL HAMBOURG S+H BASSE SAXE,regardez vers le nord ici vers le haut kiel hamburg schleswig holstein la bassesaxe se trouve un peu
AUSSI SAXE IX THUERINGEN IX AUSSI PARTIE IX MONTAGNE IX BADEN WUERTTEMBERG CHIEN DOS RHEINLAND-PFALZ,"ici aussi en Saxe ou en Thuringe, en partie en bas des Alpes dans le sud du Bade-Wurtemberg et ici aussi dans le Hunsrück en Rhénanie-Palatinat"
MAIS EN PLUS IL Y A DE LA NEIGE,mais il n'y a presque pas de neige alors que les nuages arrivent de l'ouest
MAIS TOT LE MATIN UN PEU DE PLUIE UN PEU DE NEIGE,"et demain matin, ils apporteront effectivement un peu de pluie ou de neige dans l'ouest."
MAIS ENORMEMENT DE VERGLAS,"et ensuite, cela peut devenir extrêmement glissant"
TEMPERATURE ENVIRON ZERO PUIS VRAI GEL EST IX MOINS DIX A MOINS QUINZE IX PEUT-ETRE MOINS DIX-SEPT IX,"les températures sont alors de l'ordre de zéro degré à l'ouest, mais le vrai gel, nous l'avons encore à l'est, avec moins dix à moins quinze, voire moins dix-sept degrés."
MAIS JOUR GEL REDUIRE MILIEU DEJA GEL LIBRE IX REGION A L REGION RESTE GEL MAIS GENERALEMENT PLUS SUPER SOLEIL COMME AUJOURD'HUI BAVAROIS IX AUSSI,"le gel s'atténuera très rapidement pendant la journée et le centre et l'ouest seront déjà libres de gel, tandis que nous conserverons un temps glacial de la mer Baltique à la Lusace, avec un beau soleil, comme aujourd'hui en Bavière."
NUAGE AVANT MIDI UN PEU DE PLUIE NEIGE NEIGE ALORS POSSIBLE LISSE,mais à l'ouest le temps restera maussade toute la journée il pleuvra encore un peu le matin et parfois même il neigera et ensuite il pourra encore y avoir du verglas
POURQUOI LE SOL EST ENCORE GELE IX,le sol est encore partiellement gelé
VENDREDI CALME PUIS SEC PLUS AGREABLE,vendredi détente le temps redevient sec et un peu plus agréable
PUIS SAMEDI DIMANCHE A NOUVEAU PLUIE HUMIDE MAIS NEIGE SUR CINQ CENTS SIX CENTS METRES,"mais ce week-end, le temps sera à nouveau plus humide, ce qui signifie qu'il pleuvra mais qu'il neigera aussi au-dessus de cinq six cents mètres"
JUSQU'A SAMEDI FOND HAUTE PRESSION GENERALEMENT SEC AIMABLE,"grâce à l'influence d'une haute pression, un temps généralement sec et parfois agréable nous attend jusqu'à samedi inclus"
ICI MAINTENANT NOVEMBRE DOUX VIENNENT ETRANGEMENT ICI PAYS ALLEMAND CREENT VINGT ENTRE,"En outre, l'air est exceptionnellement doux pour la saison, de sorte que la barre des vingt degrés est de nouveau à portée de main dans le sud de l'Allemagne."
CETTE NUIT GENERALEMENT CLAIR REGION NUAGE SURTOUT SUD UN PEU DE BROUILLARD DEMAIN DUR BROUILLARD,"cette nuit, le ciel sera clair ou peu nuageux sur une grande partie du territoire, en particulier dans la moitié sud du pays, avec quelques brumes qui pourraient être tenaces demain"
SUD AUSSI NUAGEUX SINON REGION AGREABLE,"des nuages apparaissent parfois, surtout dans l'ouest et le sud, sinon le temps devient agréable"
RIVIERE SUD PROBABLEMENT GELEE ZERO DEGRE RIVIERE NEUF MAXIMUM,"au sud du danube, cette nuit, des valeurs proches du point de congélation dans le bas-rhin jusqu'à neuf degrés"
DEMAIN DIX A DIX-SEPT DEGRES SUD ENCORE LIEU IX PLUS CHAUD,"demain, températures de dix à dix-sept degrés dans le sud, localement plus chaudes encore"
DIMANCHE SAMEDI DIMANCHE PROBABLEMENT SUD BROUILLARD,"samedi, dans la moitié sud-est, mélange de brouillard, de nuages et de soleil"
NORD-OUEST NUAGEUX GENERALEMENT SEC,"vers le nord-ouest, plus de nuages mais généralement sec"
DIMANCHE LUNDI VARIABLE BEAUCOUP DE NUAGES IX PLUIE,dimanche et lundi instable avec beaucoup de nuages apportant de la pluie dans certaines régions
PLUS DE VENT FRAIS,il fait plus frais et il y a du vent
MAINTENANT PREVISION METEO DEMAIN LUNDI VINGT SEPTEMBRE,et maintenant les prévisions météo pour demain lundi 20 septembre
CENTRE EUROPE VENIR SUD ALLEMAGNE REGION DEMAIN IX SOLEIL REGION BIEN,l'anticyclone au-dessus de l'europe centrale offre à la moitié sud de l'allemagne un temps calme et agréable à haute pression demain encore
SURTOUT COTE CETTE NUIT PRINCIPALEMENT PLUIE,"il pleut cette nuit, surtout en direction de la côte"
SUD RIVIERE PEU AVOIR2 BROUILLARD,"dans le sud, du brouillard se forme dans certaines rivières"
JOUR HAUT FLEUVE PAYS HABEN2 PEU NORD LAC PEU PLUS PLUIE MILIEU SOLEIL NUAGE,"le jour, il pleut au nord d'une ligne emsland uckermark à la mer du nord en partie plus longtemps au centre tantôt soleil tantôt nuages"
SUD PEU DE NUAGES BEAUCOUP DE SOLEIL,"dans le sud, outre quelques nuages convectoriels, beaucoup de soleil"
CETTE NUIT SYLT TREIZE DEGRES SUD DEJA SOL GEL PROBABLE DANGER,"cette nuit, treize degrés sur l'île de sylt au sud, il faut s'attendre à des gelées au sol"
JOUR QUATORZE DEGRES PLUIE NORD DEUX VINGT DEGRES SUD-OUEST DEUX VINGT DEGRES,"le jour, quatorze degrés sous la pluie au nord et vingt-deux degrés sous le soleil au sud-ouest"
MARDI BEAUCOUP DE SOLEIL PAS DE BROUILLARD PUIS SOLEIL UN PEU NORD UN PEU NUAGEUX UN PEU DE PLUIE,"mardi, beaucoup de soleil dès que le brouillard s'est dissipé au nord, soleil, nuages et averses isolées"
MERCREDI AGREABLE SOLEIL PEU NUAGEUX JEUDI PEU DE SOLEIL OUEST NUAGE PLUS APRES MIDI PEU DE SOLEIL ORAGES,"le mercredi, temps agréable avec quelques nuages le jeudi, d'abord du soleil plus tard, les nuages augmentent dans l'ouest l'après-midi, quelques averses et orages"
MAINTENANT COMMENT-REGARDER LE TEMPS DEMAIN JEUDI QUINZE AVRIL,et maintenant les prévisions météo pour demain jeudi 15 avril
NORD NORD-OUEST HAUT REGION VENIR AGREABLE,"dans le nord et le nord-ouest de l'allemagne, l'anticyclone au-dessus de l'atlantique assure un temps agréable"
IX NUIT NORD CLAIR SINON REGION PLUIE SURTOUT MILIEU,"dans la nuit, le ciel est souvent dégagé dans le nord et le nord-ouest sinon il pleut en certains endroits, surtout dans le centre"
MONTAGNE HAUT NEIGE NEIGE,"en haute montagne, il neige par endroits"
NORD NORD-OUEST BEAUCOUP DE SOLEIL JOUR SINON REGION DIFFERENTE MOYENNE PLUIE,"dans la journée, beaucoup de soleil dans le nord et le nord-ouest, sinon le ciel est plus ou moins nuageux, surtout dans le centre où il pleut dans certaines régions"
MONTAGNE AUSSI NEIGE NEIGE,"sur les montagnes, la neige est toujours présente"
VENT FAIBLE IX SOUFFLANT COTE SOUFFLANT,le vent est faible à modéré de nord à nord-est
CETTE NUIT SEPT DEGRES A ZERO ENTRE SI CLAIR AUSSI GEL POSSIBLE,"cette nuit, sept à zéro degré si l'éclaircie se prolonge, un léger gel est possible"
JOUR SIX ENTRE SEIZE,"pendant la journée, valeurs entre six et seize degrés"
VENDREDI RIVIERE SUD PEU DE PLUIE REGION AGREABLE,"vendredi, il pleut encore un peu au sud du Danube, sinon le temps est généralement agréable"
SAMEDI BEAUCOUP DE SOLEIL BESONDERS SUED IX NUAGE ENORME OUI MAIS NEGATIF NEGATIF PEU DE PLUIE,"samedi, beaucoup de soleil, surtout dans l'extrême sud et sur les côtes, avec parfois des nuages, mais là aussi peu de pluie"
COUVERTURE VENT,"sur les côtes, il y a du vent"
DIMANCHE SUD PARTICULIEREMENT SOLEIL NORD PARFOIS PLUIE PROBABLEMENT AVEC DE LA NEIGE,"dimanche, le soleil brille souvent dans le sud et il pleut ici et là dans la moitié nord, avec parfois de la neige"
MAINTENANT TEMPS COMMENT-APPARAITRE DEMAIN JEUDI QUATORZE JANVIER,et maintenant les prévisions météo pour demain jeudi 14 janvier
SUD-OUEST PLUS DOUX VENIR,de l'air un peu plus doux arrive dans le sud-ouest de l'allemagne
MAIS HAUTES SCANDINAVIES RESTINENT POURQUOI L'AIR VENDRAIT BLOCKER DES COUVERTURES NEGALES,"mais en même temps, l'anticyclone sur la Scandinavie est maintenu, ce qui empêche cet air de progresser vers le nord-est."
NUIT PRINCIPALEMENT REGION NEIGE PARTIE PLUIE GELEE LISSE,"dans la nuit, il neigera dans certaines régions, surtout dans la moitié sud-ouest, et des pluies verglaçantes sont possibles par endroits"
PRECAUTION GLATT,attention au verglas
JOUR NUAGE MAUVAISE PARTIE SOLEIL MAIS AUSSI NEIGE SUD-OUEST PLUIE GELEE,"en journée, nuages généralement denses, quelques rares rayons de soleil ici et là, encore quelques chutes de neige vers le sud-ouest, parfois encore de la pluie verglaçante"
SUD VENT FAIBLE NORD MODERE VENT DE COTE,"au sud, le vent est faible au nord, il est modéré sur les côtes, il est frais."
CETTE NUIT ZERO REGION MOINS TREIZE REGION THUERINGEN,"cette nuit, zéro degré dans le breisgau moins treize degrés dans le bassin de thuringe"
JOUR PLUS QUATRE MOINS CINQ THUERINGEN REGION SAXE,"en journée, plus quatre degrés dans le breisgau et moins cinq degrés dans certaines parties de la thuringe et de la saxe"
COMMENT-APPARAITRE EN-VENANT VENDREDI BRUMEUX PEU DE PLUIE CENTRE SUD SOLEIL POSSIBLE,"Vendredi, le temps sera généralement maussade avec quelques flocons au centre et un peu de soleil au sud."
SAMEDI NUAGE TOTAL PLUS DE SOLEIL,"samedi également, quelques flocons mais un peu plus de soleil dans l'ensemble"
PUIS DIMANCHE NEIGE REGION PLUIE,"dans le courant de la journée de dimanche, de la neige apparaîtra à l'ouest et de la pluie au sud-ouest."
ICI COMMENT-REGARDER LE TEMPS DEMAIN LUNDI QUINZE FEVRIER,et maintenant les prévisions météo pour demain lundi 15 février
AUJOURD'HUI ECOSSE BAS VENIR IL-SIGNIFIE BAS SUD PLUS DOUX,la dépression qui se déplacera demain en direction de l'Ecosse fera que le temps deviendra lentement plus doux chez nous dans les jours à venir à partir du sud-ouest.
SPECIALEMENT CETTE NUIT SUD MILIEU MONTAGNE NEIGE POSSIBLE,"dans la nuit, il peut encore neiger un peu, surtout dans les moyennes montagnes de l'ouest ainsi que dans l'extrême nord du pays"
DEMAIN NUAGE PLUS-MOINS OUEST NORD PARFOIS LEGERE PLUIE,"en journée, les nuages sont plus ou moins rapprochés les uns des autres à l'ouest et au nord-est, il neige encore légèrement à certains endroits"
PARFOIS SOLEIL SPECIAL SUD E MONTAGNE A NORD COTE NORD,"le soleil apparaît de temps en temps, surtout dans le sud et depuis les monts Métallifères jusqu'à la mer du Nord"
VENT FAIBLE MONTRER-ECRAN SEULEMENT MODERE NORD,le vent souffle faiblement sur la mer du Nord ou modérément
CETTE NUIT MOINS TROIS NORD MOINS QUINZE SI CLAIR,cette nuit moins trois degrés à la mer Baltique et moins quinze degrés par endroits où le ciel s'éclaircit plus longtemps
ATTENTION GLATT,attention au verglas
JOUR MOINS UN SIX A MOINS UN DOUX FLEUVE SURTOUT,de moins six à plus un degré le jour le plus froid sera sur le rhin
MARDI ALORS NEIGE OU PLUIE AUTOUR DE LA GLACE SINON SOLEIL OU BROUILLARD FOIS,"mardi, il peut y avoir un peu de neige ou de pluie verglaçante dans le nord-ouest ; sinon, soleil, nuages ou brouillard."
NEIGE PLUIE GLACE PLUIE SOLEIL,tantôt la neige tantôt la pluie tantôt la pluie verglaçante tantôt le soleil
DIFFERENCE VENT METEO TOUT LE MONDE SOUHAITE SOIREE SALUER HOMMES SALUER,"Le temps hivernal est en train de nous jouer des tours et je vous souhaite une bonne soirée, mesdames et messieurs."
POUVEZ VOUS RESTER SUR LA ROUTE GLISSANTE CETTE NUIT,"il peut encore y avoir du verglas sur nos routes, même cette nuit"
PUIS RISQUE DE PLUIE VERGLAÇANTE SURTOUT REGION NORD,"Nous nous attendons à des pluies verglaçantes, surtout dans le nord de l'Allemagne."
SUD PLUIE RAISONNABLE ONT2 BROUILLARD BASSE TEMPERATURE MOINS CINQ A MOINS DEUX DEGRES,"dans le sud, les étoiles scintillent en partie et un brouillard épais se forme avec des températures minimales entre moins cinq et moins deux degrés"
DEMAIN HAUTE VALEUR MOINS UN A PLUS SIX DEGRES,"demain, nous attendons des températures maximales comprises entre moins un et plus six degrés"
CETTE TEMPERATURE ENORMEMENT PROCHE DE ZERO PEUT ETRE LISSE EXEMPLE PROMENADE ROUTE,et même ces températures sont encore si proches du point de congélation que les chemins et les routes peuvent être glissants.
ET PUIS LENTEMENT L'EST LE NORD-EST LE SOLEIL A NOUVEAU,Même si les chutes de neige se déplacent lentement vers l'est et que le soleil réapparaît sur la côte de la mer du Nord.
VRAIMENT AGREABLE SUD-OUEST ET REGION JUSQU'A ALLGAEU REGION SOLEIL,"demain, le temps sera vraiment agréable dans le sud-ouest, du Rhin supérieur à l'Allgäu, où le soleil se montrera plus souvent."
TEMPS HIVERNAL RAISONNABLEMENT CALME,notre météo hivernale se poursuit plutôt tranquillement
VARIABLE SOLEIL NUAGE PARFOIS AUSSI NEIGE PARFOIS PLUIE,"parfois le soleil brille, parfois il y a des nuages plus épais, parfois un peu de neige, parfois un peu de pluie"
TEMPERATURE A NOUVEAU ENORMEMENT FORTE JUSQU'A VENDREDI,et les écarts de température s'accentuent jusqu'à la fin de la semaine.
PUIS NORD-EST MOINS SEPT SUD-OUEST MOINS CINQ PLUS CINQ,"alors, au nord-est, ils sont dans un gel permanent de moins sept degrés et, au sud-ouest, de plus cinq degrés"
DESOLE SCHOEN TSCHUESS,ce qu'il reste pour cette belle soirée
MAINTENANT TEMPS COMMENT-APPARAITRE DEMAIN MERCREDI ONZE AOÛT,et maintenant les prévisions météo pour demain mercredi 11 août
HAUT NORD-EST VENIR MAINTENANT BAS VENIR,le petit anticyclone disparaît en direction du nord-est et laisse la place aux nuages d'une dépression de la mer du Nord
BAS IN-KOMMEND FAIRE TEMPS VARIABLE,"et les jours suivants, le temps sera très instable."
DEMAIN LA PLUPART DES NUAGES PARTIE PLUIE AVERSES,"en journée, les nuages dominent le ciel et il pleut ou averse dans certaines régions."
PUIS APRES MIDI AUSSI ORAGES VIOLENTS,"dans l'après-midi, il y a aussi des orages qui peuvent être violents"
SOLEIL SURTOUT SUD-EST EN COURS NORD-OUEST AUSSI SOLEIL,le soleil se montre de préférence au sud-est et plus tard aussi en direction de la mer du nord
GENERALEMENT FAIBLE IX VENTS SI AVERSES ORAGE FORT VENT,vent du sud-ouest généralement faible à modéré avec de fortes rafales près des averses et des orages
CETTE NUIT FORET IX DIX DEGRES EST REGION IX MAXIMUM DIX-SEPT SAUER LAND,dix degrés cette nuit dans la forêt bavaroise au bord de la mer Baltique jusqu'à dix-sept degrés
DEMAIN NEUF DIX-NEUF REGION SEPT VINGT MAXIMUM,"dans la journée, dix-neuf degrés dans le Sauerland à vingt-sept degrés dans la Lausitz"
PARFOIS IX LONGUE PLUIE POSSIBLE,"dans certains endroits, il peut pleuvoir longtemps et abondamment"
VENDREDI SURTOUT EST SUD-EST EN FAIT SURTOUT PLUIE OUEST PLUS AGREABLE,"vendredi, surtout dans l'est et le sud-est, parfois de fortes pluies vers l'ouest, temps plus agréable"
PUIS SAMEDI DIMANCHE VARIABLE AUSSI,le week-end s'annonce également changeant
DEMAIN TEMPS COMMENT-APPARAITRE SAMEDI SIX VINGT JUIN,et maintenant les prévisions météo pour demain samedi 26 juin
SUD REGION NUAGEUX POSSIBLE AVERSES ORAGEUX,"dans le sud, de l'air encore plus humide se maintiendra demain et pourra donner lieu à des averses et des orages isolés"
VENT VENTS FAIBLES,le vent est faible dans le nord et modéré dans le nord.
REGION SEPT VINGT A HUIT VINGT DEGRES NORD FRAIS DIX-SEPT A DIX-HUIT DEGRES,sur le main et le rhin supérieur demain sept et vingt à vingt-huit degrés sur la côte de la mer du nord et de la mer orientale frais dix-sept à dix-huit degrés
DIMANCHE REGION SOLEIL SOIR SUD-OUEST ES-IMPLIQUE MONTAGNE PLUIE ORAGE PEUT ETRE,"dimanche sera ensoleillé sur une grande partie du territoire en fin de journée, quelques averses et orages sont possibles dans le sud-ouest, surtout en montagne"
TEMPS COMMENT-APPARAITRE DEMAIN LUNDI SEPTIEME MARS,et maintenant les prévisions météo pour demain lundi 7 mars
SEMAINE NORD DEBUT HAUT VENIR SOLEIL MARDI PLUS CHAUD,la nouvelle semaine commence par un temps ensoleillé sous l'influence d'une haute pression et le mardi sera également plus doux
MERCREDI VENIR BAS PLUIE VENIR,"dans le courant de la journée de mercredi, le contrefort d'une dépression de la mer du nord nous envoie à nouveau des nuages de pluie"
CETTE NUIT IX LE PLUS SOUVENT MONTAGNE NUAGE REGION CLAIR ETOILE IX BROUILLARD,"cette nuit, le ciel est encore nuageux dans le sud, surtout en bordure des alpes, sinon les étoiles scintillent partout dans le ciel, ici et là du brouillard se forme"
JOUR SOLEIL TOUTE LA JOURNEE NORD PEU NUAGE INOFFENSIF,"pendant la journée, le soleil brille dans tout le pays, sauf dans le nord, où quelques nuages inoffensifs apparaissent."
NORD REGION VENT FAIBLE VENTS MODERES VENT DEMAIN TEMPETE VENTS,"dans la moitié nord, le vent sera faible à modéré demain et soufflera du sud ; ailleurs, il sera modéré à frais, avec des rafales fortes et, en montagne, des vents d'est plus violents"
DEMAIN FROID NUIT NORD FLEUVE MOINS DEUX REGION MOINS DIX,"une nouvelle nuit glaciale nous attend à la mer du nord et dans le bas-rhin, moins deux degrés dans la forêt bavaroise, des températures négatives à deux chiffres"
DEMAIN MEME TEMPERATURE QU'AUJOURD'HUI DEUX REGION FLEUVE DIX,demain encore des températures similaires à celles d'aujourd'hui de deux degrés dans le Vogtland à dix dans le Rhin supérieur
MARDI PLUS CHAUD LE PLUS SOUVENT SOLEIL,"mardi, le temps sera un peu plus doux et le soleil brillera la plupart du temps"
MERCREDI IX VENIR MILIEU PARTIE PLUIE IX SUD GENERALEMENT AGREABLE,"mercredi, des nuages s'étendent du nord jusqu'au centre, avec quelques pluies dans certaines régions, le sud étant généralement agréable"
JEUDI FRAIS NORD PLUIE VENT SUD RESTER SEC,jeudi à nouveau plus frais au nord pluie et vent très fort vers le sud le temps reste globalement sec
DEMAIN TEMPS COMMENT-APPARAITRE VENDREDI DIX-HUIT JUIN,et maintenant les prévisions météo pour demain vendredi 18 juin
NORD REGION MATIN HAUTE PRESSION SOLEIL FIN,le temps anticyclonique prend également fin demain dans le nord de l'allemagne
ALPES BASSE VENIR POLONAISE VENIR REGION PLUIE ORAGE,la dépression qui se déplace des Alpes vers la Pologne provoque des pluies parfois fortes et orageuses dans le Sud
NORD PAS CE SOIR UN PEU DE NUAGES SURTOUT SUD PLUIE ORAGE AUSSI PRESENT,"en direction de la mer du nord, le ciel deviendra un peu plus nuageux dans la nuit, surtout dans le sud où il pleuvra parfois abondamment et où des orages seront également présents"
JOUR REGION SOLEIL PLUIE VARIABLE POUVOIR REGION PLUIE REGION,"dans la journée, au nord et à l'ouest, soleil et nuages avec quelques gouttes de pluie au sud et au sud-est, il continue à pleuvoir fortement dans certaines régions"
NORD-OUEST VENTS VENTS PUIS ORAGES VENTS PUIS VENTS MODERES,"dans la moitié nord-ouest, le vent est modéré à frais avec des rafales fortes à tempétueuses en mer du nord, sinon, à l'exception de rafales orageuses, le vent est faible à modéré"
CETTE NUIT QUINZE REGION A SIX NORD-EST,"cette nuit, quinze degrés sur le Danube et jusqu'à six degrés dans le nord-est"
JOUR TREIZE SUD PLUIE JUSQU'A CINQ VINGT REGION,le jour treize degrés par pluie persistante au sud jusqu'à vingt-cinq degrés à la ou
SAMEDI IX AVERSES PEUVENT FOUDRE PEUVENT REGION SUD PLUIE SEULEMENT DOUZE A DIX-HUIT DEGRES,"samedi, averses ici et là, parfois accompagnées d'éclairs et de tonnerre au sud du danube, il ne pleut plus que douze à dix-huit degrés pendant une période prolongée"
DIMANCHE TEMPS CHANGEANT AVERSES REGION PLUIE LUNDI PUIS TEMPS CALME MOINS,"dimanche, temps variable avec des averses en bordure des Alpes pluie lundi, le temps se calme progressivement"
MAINTENANT DEMAIN TEMPS COMMENT-APPARAITRE LUNDI TREIZE SEPTEMBRE,et maintenant les prévisions météorologiques pour le lundi 13 septembre
DANEMARK IX COTE BASSE VENIR ALLEMAND PAYS VENIR,le contrefort d'une dépression au large de la côte norvégienne traverse l'allemagne vers l'est avec des nuages de pluie
FROID PLUIE AUSSI PUIS MARDI PROCHAIN BAS VENIR,"derrière, de l'air plus frais s'écoule et subit brièvement une légère influence anticyclonique avant que la prochaine dépression ne nous atteigne mardi"
EST SUD-EST CETTE NUIT NUAGE PUIS PLUIE VENIR FORTE PLUIE POUVOIR,"dans l'est et le sud-est, les nuages ont d'abord encore de grands espaces cette nuit, sinon il y aura de la pluie sur une grande partie du territoire, qui sera forte par endroits"
DEBUT ORAGE AVEC,"au début, il y a aussi quelques orages"
PLUIE EN COURS OUEST PLUIE DISPARAIT IX MATIN VOIR QUELQUES SOLEIL IX REGION AVERSES,"dans le courant de la nuit, la pluie s'atténuera dans l'ouest et le soleil pourra s'y montrer plus longtemps demain, tandis que dans la moitié est, il pleuvra ou tombera des averses dans certaines régions"
VENT VENT,"demain, le vent sera faible à modéré et soufflera de l'ouest."
AUJOURD'HUI NUIT UNE DOUZE A QUINZE SUEDOST SEPT A NEUF ET NUAGE CIEL NEGALP-KEIN,"cette nuit, dix à quinze degrés doux dans le sud-est sous un ciel clair, sept à neuf degrés seulement"
DEMAIN REGION TREIZE REGION QUATORZE A DIX-HUIT EST DIX-HUIT,au pied des alpes demain treize sinon quatorze à dix-huit le long du rhin jusqu'à dix-neuf degrés
MARDI MERCREDI NORD VENT PEUVENT JEUDI VARIABLE NUAGE DISPARAISSENT AVEC AVERSES PLUIE,"mardi et mercredi, parfois très venteux dans le nord ; jeudi, nuages plus ou moins abondants apportant ici et là des averses ou de la pluie"
MAIS RESTENT SECS,le temps reste assez doux
SUD-EST IX HAUT IX FRANCE IX BAS PLUS VENIR MAINTENANT CHAUD HUMIDE,"entre l'anticyclone au-dessus de l'europe du sud-est et la dépression au-dessus de la france, de l'air très chaud et de plus en plus humide s'écoule vers nous"
BAS IX NUAGE IX VENIR DEMAIN AVERSES ORAGES,les nuages de la dépression se font sentir demain soir avec des averses et des orages venant de l'ouest
DEMAIN PEU DE NUAGES DEMAIN BEAUCOUP DE SOLEIL,"demain, à l'exception de quelques nuages, à nouveau beaucoup de soleil"
APRES-MIDI SUD-OUEST NUAGE PUIS AVERSES ORAGE AH LIEU PLUIE OU PLUIE FORTE PLUIE,"l'après-midi, des nuages convectoriels se formeront dans la moitié sud-ouest averses et orages suivront localement avec grêle et fortes pluies"
DEMAIN VENT DU SUD VENT FAIBLE ORAGE IX VENIR TEMPETE POSSIBLE,"demain, le vent sera généralement faible de secteur sud et des rafales de vent d'ouest pourront se produire en soirée en cas d'orages"
CETTE NUIT QUINZE ENTRE SEPT JOUR IX FLEUVE MAXIMUM UN VINGT DEGRES,"cette nuit, températures comprises entre quinze et sept degrés en journée vingt-et-un degrés sur les côtes et jusqu'à trente degrés dans le Rhin supérieur"
LUNDI NUIT AVERSES ORAGES ARRIVENT LUNDI SUD-EST AVERSES REELLES MAXIMUM SIX VINGT DEGRES,"dans la nuit du dimanche au lundi, les averses et les orages se déplacent vers l'est le lundi, puis dans le sud-est encore des averses jusqu'à vingt-six degrés"
MERCREDI CHANGEANT,"mercredi, temps variable"
MAINTENANT TEMPS COMMENT-APPARAITRE DEMAIN VENDREDI CINQ VINGT MARS,et maintenant les prévisions météo pour demain vendredi 25 mars
IRLANDE IX VENIR POSSIBLE EUROPE NORD VENIR ALLEMAND REGION NORD,l'anticyclone au-dessus de l'irlande se retire quelque peu ce qui permet aux nuages des dépressions au-dessus de l'Europe du Nord de pénétrer dans le nord de l'Allemagne
CE SAMEDI PLUS FROID TEMPERATURE PARTICULIEREMENT NORD BAISSE,"samedi, de l'air nettement plus frais nous parviendra - les températures baisseront surtout dans la moitié nord du pays."
JOUR NORD-EST IX HEURES FORT NUAGE MILIEU MONTAGNE NORD PEU DE PLUIE,"en journée également, nuages parfois denses au nord et à l'est, quelques pluies au nord des montagnes moyennes"
SUD-OUEST AUSSI IX ONT SOLEIL SEULEMENT UN PEU DE NUAGES,"en direction du sud-ouest, le soleil brille à côté de nuages voilés"
VENT FAIBLE VENT MODERE VENT FORT,le vent est faible à modéré en mer du Nord et en mer Baltique avec de fortes rafales
RIVIERE CETTE NUIT SIX MONTAGNE MOINS TROIS,"cette nuit, six degrés en sarre et moins trois degrés dans les alpes"
RUEGEN IX CINQ DEGRES CHAUD VINGT DEGRES,"le jour, il fait cinq degrés à Rügen et vingt degrés dans le Rhin supérieur"
SAMEDI PROBABLEMENT BEAUCOUP DE NUAGES PLUIE NEIGE PLUIE SUD AUSSI ORAGES,samedi beaucoup de nuages ici et là des averses de pluie ou de neige dans le sud également quelques orages
APRES MIDI NORD DEVRAIT NUAGEUX,"l'après-midi, le ciel se dégage à nouveau dans le nord"
DIMANCHE PLUS AGREABLE AU SUD SINON AVERSES,"dimanche, le temps deviendra de plus en plus agréable au cours de la journée, avec encore des averses au sud du danube"
LUNDI SOLEIL NUAGE SUD AVEC ORAGE,"lundi : soleil et nuages dans le sud, orages dans le nord"
MAINTENANT TEMPS DEMAIN VENDREDI NEUF AVRIL,et maintenant les prévisions météo pour demain vendredi 9 avril
CETTE NUIT ALLEMAND PAYS ZONE VENIR IX PEU DE PLUIE,"cette nuit, une bande de nuages traverse l'allemagne et se déplace vers le sud-est en laissant tomber quelques pluies par endroits"
REGION CLAIR LIEU BROUILLARD,"à l'avant et à l'arrière de la bande nuageuse, le ciel est partiellement dégagé et du brouillard se forme localement"
DEMAIN PRINCIPALEMENT DES NUAGES MAIS AUSSI DU SOLEIL,"demain, il y aura des nuages épais mais aussi du soleil par intermittence"
