orth,translation
EST SUD-EST CLAIR NUAGEUX LONG SOLEIL DEMAIN,"dans l'est et le sud, ciel dégagé ou peu nuageux sur une grande partie du territoire, où le soleil brillera demain pendant une période prolongée"
NORD-OUEST PARTIE FORTE AVERSES APRES-MIDI AUSSI ORAGES,"dans la moitié nord-ouest, averses parfois fortes dans certaines régions l'après-midi, orages également présents"
PUIS ORAGE SUD-EST FAIBLE VENT NORD-OUEST PLUS TARD VENT,"dans ce cas, des rafales de vent sont également possibles sinon vent faible à modéré de secteur sud à sud-ouest dans la moitié nord-ouest, plus tard de secteur ouest"
FRAIS HUIT BAS BAVIERE DIX-HUIT FLEUVE,huit degrés frais cette nuit en Basse-Bavière jusqu'à dix-huit degrés sur la Spree
NORD UN VINGT BAVIERE IX A TRENTE DEGRES,à la mer du nord demain vingt-et-un à lausitz jusqu'à trente degrés
DEMAIN LUNDI VARIABLE PRINCIPALEMENT SUD-EST PARTIE ORAGEUSE PLUIE,"lundi, le temps sera changeant partout, surtout dans l'est et le sud, avec des pluies parfois orageuses et abondantes"
MARDI LENT DEGAGEMENT,"mardi, le temps redevient un peu plus agréable"
MERCREDI AVERSES FORTES ET ORAGES,"mercredi, de nouvelles averses et de nouveaux orages parfois violents arriveront du nord-ouest"
INFORMER MAINTENANT SUR LA METEO POUR DEMAIN JEUDI DIX FEVRIER,"et maintenant les prévisions météorologiques pour demain, jeudi 10 février"
AUJOURD'HUI TEMPS PARTOUT BON TEMPS PEU VENIR DES DEMAIN REGION SUD MAIS SOLEIL REGION BON,l'anticyclone qui a déterminé notre temps aujourd'hui se retire mais donne encore le ton demain dans le sud de l'Allemagne
NORD-OUEST DEMAIN SOIR PLUIE NUAGE VENIR DE GRAND VENIR,la moitié nord-ouest sera touchée demain soir par des nuages de pluie provenant d'une dépression qui se dirige vers la Grande-Bretagne
NUIT PLUS CLAIR UN PEU DE BROUILLARD SURTOUT SUD ALLEMAGNE REGION,la nuit sera claire dans certaines régions il y aura des champs de brouillard surtout dans les plaines du sud de l'allemagne
CENTRE REGION SUED PLUS DE NUAGES VIENNENT,quelques nuages passent au-dessus du centre et du sud
JOUR SUED PLUS DE BRUME PARTIE SOLEIL AGREABLE SINON REGION UN PEU DE NUAGES POSSIBLE ENTRE AUSSI UN PEU DE SOLEIL,"pendant la journée, le temps est parfois brumeux et parfois agréable dans le sud, sinon il y a quelques nuages entre lesquels le soleil se montre parfois."
IX SUD FAIBLE VENT NORD MODERE VENT NORD-OUEST FRAIS VENT,"le vent est faible au sud et modéré au nord, voire frais dans le nord de la Frise"
CETTE NUIT PLUS TROIS A MOINS CINQ DEGRES MONTAGNE SOUS,"cette nuit, plus trois à moins cinq degrés dans les Alpes, valeurs inférieures à ces valeurs"
JOUR DEUX DEGREES SANS INTERRUPTION BRUME REGION DOUZE DEGREES OUEST REGION,"le jour, deux degrés à dauernebel sur le danube et douze degrés à l'ouest"
VENDREDI BEAUCOUP DE NUAGES LIEU PLUIE,"vendredi, nombreux nuages, pluie dans certaines régions"
SAMEDI NORD-EST UN PEU FROID UN PEU DE PLUIE,"samedi, un peu de soleil mais du froid dans le nord-est"
SINON BEAUCOUP DE NUAGES PEU DE LIEU PEU DE PLUIE,sinon beaucoup de nuages par endroits un peu de pluie
DIMANCHE PLUIE IX NORD-EST GEL OU NEIGE,"dimanche, il pleut ici et là dans le nord-est pluie verglaçante ou neige"
MAINTENANT TEMPS DEMAIN JEUDI ONZE FEVRIER,et maintenant les prévisions météo pour demain jeudi 11 février
POUR L'INSTANT CENTRE EUROPE BASSE REGION ES-CELA SIGNIFIE DEMAIN AUSSI VENDREDI COMME TEMPS CHANGEANT,la dépression qui s'étend de l'europe centrale jusqu'à la région méditerranéenne nous apporte un temps hivernal instable demain et également vendredi
CETTE NUIT REGION SUD-EST SURTOUT NEIGE POSSIBLE NUIT EN COURS MILIEU AUSSI NEIGE,"cette nuit, la neige tombera sur une grande partie du sud-est et s'étendra jusqu'au centre en cours de nuit"
REGION POSSIBLE NEIGE ATTENTION POSSIBLE VERGLAS,il neige aussi par endroits prudence en raison du verglas
DEMAIN REGION SUD NEIGE MILIEU AUSSI NEIGE NORD PEU,"dans la journée, il a neigé dans le sud pendant une période prolongée et dans le centre, il a neigé temporairement dans le nord, mais seulement faiblement"
VENT DU SUD FAIBLE POSSIBLE TEMPETE DE MONTAGNE OU VENT DE NEIGE,"dans le sud, le vent est faible sinon modéré à frais sur les montagnes, des rafales de vent sont possibles avec des congères."
CETTE NUIT VALEUR MOINS TROIS DEGRES IX MOINS TREIZE DEGRES,"cette nuit, des valeurs entre moins trois et moins treize degrés"
DEMAIN MER IX MOINS UN BAS BAVAROIS MOINS SIX DEGRES,moins un degré en journée à la mer jusqu'à moins six degrés dans certaines parties de la Bavière
VENDREDI AUSSI NEIGE PRINCIPALEMENT NORD-EST CENTRE EST LAC VENT FORT,"Vendredi, nouvelles chutes de neige. Les chutes de neige les plus importantes se produisent du nord-est au centre de la mer Baltique."
MAINTENANT TEMPS DEMAIN VENDREDI SIX VINGT NOVEMBRE,et maintenant les prévisions météo pour demain vendredi 26 novembre
SUD BAS SUD-EST AUSSI BAS NUIT DEMAIN BEAUCOUP DE NEIGE NEIGE,une dépression provoque de la neige ou de la pluie de neige dans le sud et l'est de l'allemagne pendant la nuit et la journée de demain
VENT FAIBLE MODERE DIVERS VENTS,le vent est faible à modéré et souffle dans différentes directions
CETTE NUIT NORD-OUEST ZERO MOINS HUIT SI CIEL CLAIR,"cette nuit, zéro degré sur les îles de la Frise orientale à moins huit degrés là où le ciel s'éclaircit"
JOUR MILIEU MONTAGNE DEUX MOINS DEUX MOINS PLUS DEUX DEGRES,"en journée, moins deux degrés en moyenne montagne et plus trois degrés sur le Rhin"
SAMEDI IX AGREABLE REGION MAIS PARTIE PRINCIPALEMENT REGION,"samedi, le temps est en partie agréable et en partie plus nuageux"
NEIGE NIVEAU NEGATIF Rarement,les averses de neige sont rares
LUNDI SUD PUIS PARTIE LIEU NEIGE NEIGE,"lundi, des chutes de neige sont attendues dans certaines régions de la moitié sud du pays"
SINON REGION NUAGE DIVERS,sinon les nuages sont plus ou moins proches les uns des autres
CHER SPECTATEUR BON SOIR,"Chers téléspectateurs, bonsoir"
BISHER JANVIER ENORMEMENT FROID POSSIBLE BISHER neg-HABEN PARTICULIEREMENT FROID,le mois de janvier a été jusqu'à présent presque partout quelques degrés plus froids que la normale
PRINCIPALEMENT FROID OÙ NRW SAXE ANHALT,les plus froids en rhénanie-du-Nord-Westphalie en saxe et aussi en saxe anhalt
REGION RESTER FROID UN PEU PLUS CHAUD OÙ REGION SUD-OUEST POSSIBLE PLUIE OU VERGLAS,"et il semble que le froid se poursuive avec de petites restrictions, ce qui signifie un air un peu plus doux et parfois de la pluie ou du givre dans le sud-ouest."
OU PLUIE OU PLUIE VERGLAÇANTE,Mais il peut aussi y avoir de la pluie verglaçante ou de la pluie.
DONC POSSIBLE GLISSE,et les routes peuvent être très glissantes.
NORD TEMPETE VENTS FORTS NEUF NORD REGION POSSIBLE SOLEIL,"dans le nord, vent tempétueux, rafales de force neuf en mer du nord, sinon entre les deux, en partie soleil, parfois aussi"
DONC QUELQUES AGREABLES CONVIENNENT BIEN FROID CONTINU SEULEMENT REGION SUD-OUEST POSSIBLE PLUS CHAUD,"et c'est en fait un temps d'hiver très agréable, qui correspond aussi aux températures, toujours glaciales, sauf dans le sud-ouest où l'air est un peu plus doux."
SUD SUD-OUEST RESTER PLUS CHAUD,et elle aura tendance à se maintenir dans les jours à venir dans le sud-ouest.
REGION FROID NORD POSSIBLE NEIGE VENT,"sinon, le temps reste froid dans le nord avec parfois un peu de neige et un vent fort"
BON SOIR COMMUNIQUER,"Sur ce, je vous souhaite une bonne soirée."
BAS LAC NORD CETTE NUIT PEUT VENIR PLUIE,La dépression qui se forme au cours de la nuit au-dessus de la mer du Nord provoque du vent et de la pluie demain.
PROBABLEMENT ENCORE DOUX,alors qu'il fait encore doux
VENDREDI VENIR FROID AIR NORD EST VENIR PLUS COMME HIVER TEMPS MOINS,"Vendredi, de l'air plus froid arrive du nord-est et le temps devient plus hivernal."
VENT MODERE FRAIS VENT MER PEUVENT TEMPETE VENT,"le vent souffle modérément à fraîchement, avec des rafales de vent isolées, voire tempétueuses sur les montagnes"
TEMPS DEMAIN COMMENT-APPARAITRE LUNDI TREIZE JUILLET,et maintenant les prévisions météo pour demain lundi 13 juillet
ALLEMAGNE DEMAIN BAS VENIR HAUT VENIR ALLEMAGNE REGION,"demain, l'allemagne se trouvera entre un système de basse pression au nord et une zone de haute pression au sud de l'europe"
PARTICULIEREMENT SUD REGION CHAUD NUAGE AVERSES PEUVENT SE PRODUIRE,"de l'air chaud et humide, donc propice aux averses, est ainsi dirigé vers le sud de l'allemagne"
"AU COURS DE LA JOURNEE, LA NEIGE CHAUDE ET LA PLUIE PEUVENT SE TRANSFORMER EN ORAGE","Les jours suivants, des orages violents peuvent se former dans l'air chaud et humide."
CETTE NUIT IX AVERSES PEU ORAGEUX,"cette nuit, averses ici et là, orages isolés"
CENTRE NORD PEUT SE DISSIPER BROUILLARD PEUT VENIR,"au centre et au nord, le ciel se dégage partiellement et du brouillard se forme par endroits"
VENT FAIBLE SOUFFLANT MODERE MONTRER-ECRAN,le vent est faible à modéré du sud-ouest à l'ouest
SOIR FRAIS BAISSE DE SEIZE A ONZE DEGRES,"Ce soir, le temps se rafraîchit et les températures oscillent entre seize et onze degrés."
DEMAIN TEMPERATURE DIX-NEUF REGION A HUIT VINGT REGION,"demain, les températures iront de dix-neuf degrés à la mer du Nord à vingt-huit degrés dans le Brisgau"
MARDI BEAUCOUP DE NUAGES CHANGEANT PEUVENT IX AVERSES SUD EST PLUIE FORTE,"mardi, ciel partiellement dégagé ou nuageux avec averses ou orages violents dans la moitié sud-est du pays"
MERCREDI SOLEIL SURTOUT SUD AVERSES ECLAIRS PEUVENT,"mercredi, outre le soleil, averses ou orages violents surtout vers le sud-est"
JEUDI PRINCIPALEMENT AGREABLE SOLEIL SUD PEU D'ORAGE,jeudi généralement agréable dans le sud quelques orages forts
MAINTENANT DEMAIN MERCREDI DIX AOÛT COMMENT-APPARAISSENT LE TEMPS,et les prévisions météo pour demain mercredi 10 août
A DEMAIN BAS VENIR IX REGION PUIS JEUDI REGION VENIR LONGUE PLUIE,"une dépression en provenance de l'atlantique nous atteindra demain, d'abord dans le nord-ouest, puis jeudi dans toute la moitié nord de l'allemagne, avec des pluies parfois prolongées."
SUD AVANTAGE HAUT PRESSION VENIR,le sud au moins profite d'une légère influence anticyclonique
CE SOIR TROU AVERSES BEAUCOUP DE NUAGES PUIS PARTIE ETOILES PEUVENT VOIR,cette nuit il y aura encore des averses locales sinon beaucoup de nuages dans certaines régions les étoiles scintillent aussi
DEMAIN PARTIE LE PLUS SOUVENT NUAGEUX PUIS AGREABLE MONTAGNE IX LE PLUS SOUVENT AVERSES,"demain, ciel en partie très nuageux et en partie dégagé, averses isolées, en particulier à proximité des Alpes"
NORD-OUEST EN COURS PLUIE MILIEU NORD-EST MILIEU MONTAGNE OU RIVIERE VENIR,"plus tard, des pluies s'étendent depuis le nord-ouest et atteignent en soirée les montagnes moyennes du nord et les ou"
SUD-OUEST SOLEIL IX,c'est dans le sud-ouest qu'il y a le plus d'heures d'ensoleillement
DEMAIN IX VENT FAIBLE IX NORD-EST VENT FRAIS REGION VENT FORT TEMPETE,"le vent sera faible demain dans le nord et l'est, parfois frais, et fort dans la mer Baltique avec des rafales de vent."
MAINTENANT REGION CETTE NUIT QUATORZE SI CIEL CLAIR SEULEMENT SIX,au bord de la mer cette nuit quatorze sous un ciel clair localement seulement six degrés
DEMAIN QUINZE DIX-NEUF VINGT A DEUX VINGT DEGRES,demain quinze à dix-neuf le long du rhin vingt à vingt-deux degrés
JEUDI IX SURTOUT NORD PLUIE LONG SUD PLUS AGREABLE,"jeudi, pluie parfois persistante surtout dans la moitié nord, plus agréable dans le sud"
VENDREDI REGION NUAGE AVERSES AUSSI ORAGES,"Vendredi : beaucoup de nuages, averses ici et là, orages isolés."
SAMEDI PARTIELLEMENT AGREABLE PARTIELLEMENT NUAGEUX PARTIELLEMENT AVERSES,"samedi, ciel partiellement dégagé et averses par endroits"
PLUS CHAUD,il fait plus chaud
MAINTENANT TEMPS COMMENT-APPARAITRE DEMAIN DIMANCHE NEUF VINGT MAI,"et maintenant les prévisions météorologiques pour demain, dimanche vingt-neuf mai"
HAUT ENTRE SUD EUROPE C'EST DIMANCHE JE BEAUCOUP DE SOLEIL,une haute altitude au-dessus de l'europe centrale et méridionale assure un ensoleillement fréquent chez nous aussi ce dimanche
NORD REGION PEU NUAGEUX NORD IX,le nord de l'allemagne est cependant balayé par les nuages d'une dépression sur la mer du nord
NUAGE NUIT NORD CENTRE ENTRE A VENIR PLUIE,"et ces nuages recouvrent cette nuit la moitié nord de l'Allemagne, de l'Ems jusqu'à la Poméranie occidentale."
IX UN PEU NUAGEUX MAIS GENERALEMENT CLAIR,"dans la moitié sud, le temps est généralement clair, à l'exception de quelques nuages de traîne"
NORD NORD-OUEST BEAUCOUP DE NUAGES JUSTE REGION PLUIE,"dans le nord et le nord-ouest, de nombreux nuages persisteront demain et apporteront quelques pluies, en particulier sur les côtes"
REGION SOLEIL RESTER BEAU,"sinon, le soleil brille souvent et le temps reste sec"
IX VENTS FAIBLES NORD VENTS MODERES,"au sud, le vent est faible au nord, modéré à frais, de secteur sud-ouest"
IX APRES-MIDI TEMPETE,la mer du nord sera balayée par des rafales de vent à partir de l'après-midi
CETTE NUIT SUD CLAIR SEULEMENT BAS DIX REGION A DOUZE,"cette nuit dans le sud, sous un ciel clair, seulement des valeurs à un chiffre près de la côte jusqu'à douze degrés"
IX DEMAIN QUINZE IX LAC DE CONSTANCE JUSQU'A SIX VINGT,là demain quinze à dix-huit au lac de Constance jusqu'à vingt-six degrés
LUNDI PARTOUT SOLEIL APRES-MIDI QUELQUES AVERSES ORAGEUSES,"lundi, temps ensoleillé sur une grande partie du territoire - quelques averses et orages dans l'après-midi"
MARDI PLUIE PARTIE ORAGE,"mardi, des pluies s'étendent depuis l'ouest et sont accompagnées d'orages locaux"
MIDI MERCREDI PLUS FRAIS,mercredi nettement plus frais
EST SUD PLUIE NORD-OUEST AGREABLE SEC,"à l'est et au sud, il pleut encore vers le nord-ouest, temps agréable et sec"
DEMAIN AUSSI PLUS LOIN,ce sera encore le cas demain
MAIS JUSTE ALORS AUTOMNE IN-KOMMEND DEBUT DEMAIN MATIN CINQ HEURES NEUF JUSTE DEBUT CALENDRIER IX,"mais ensuite, l'automne commencera demain matin à cinq heures neuf du matin."
TEMPS PRESQUE DROIT CHANGER EN TEMPS RAISON AUTOMNE DEBUT,et le temps changera lui aussi presque à temps pour le début de l'automne
NOUVEAU TEMPS VENIR REGION EST PROCHAIN BAS VENIR,l'anticyclone de beau temps continue de se déplacer vers l'est et les prochaines dépressions nous parviennent de l'Atlantique
NUIT ENCORE CLAIRE BROUILLARD DEMAIN MATIN ENCORE BROUILLARD IX,"après une nuit encore claire avec quelques brumes, il restera encore des brumes ici et là demain matin"
MAIS ENSUITE SOLEIL REGION,"mais sinon, le soleil brille encore une fois largement"
IX RESTER A TRAVERS,et ce sera le cas tout au long de la journée
MAIS OUEST NUAGE CIEL,"cependant, des champs nuageux plus denses se déplaceront déjà au-dessus de l'ouest"
MAIS LE SOIR OUEST SUD DEBUT DE PLUIE OU D'ORAGE,"mais probablement seulement en soirée dans l'extrême ouest et aussi sur la bordure des Alpes, premières averses ou orages"
AVERSES AVANT EFFECTIVEMENT CHAUD EXEMPLE CINQ VINGT SIX VINGT DEGRES REGION PAS LA MOITIE A QUATRE VINGT NORD AUSSI AGREABLEMENT CHAUD,"avant ces averses, il fait encore très chaud un jour d'été sur le rhin vingt-cinq vingt-six degrés mais aussi ailleurs parfois même jusqu'à vingt-quatre et une chaleur agréable aussi sur les côtes"
MAINTENANT COMMENT-REGARDER LE TEMPS DEMAIN VENDREDI QUATRE JUIN,et maintenant les prévisions météo pour demain vendredi 4 juin
A PARTIR DE DIMANCHE APRES MIDI SUD-OUEST ORAGE POSSIBLE,"à partir de dimanche après-midi, le risque d'orages augmente à partir du sud-ouest"
NUIT PLUIE SUD EST PLUIE SINON REGION PEU UNE PAIRE NUAGE CLAIR,"dans la nuit, il pleut encore ici et là dans le sud et le sud-est, sinon le temps est clair à l'exception de quelques champs nuageux"
DEMAIN HEURE SOLEIL,"demain, le soleil brillera toute la journée"
SEULEMENT FLEUVE IX SUD PEU NUAGEUX ALPES DERNIERE PLUIE,l'exception au sud du danube où le temps est encore nuageux dans les Alpes où tombent les dernières gouttes de pluie
VENT FAIBLE VENT MODERE,"le vent est généralement faible, parfois modéré."
CETTE NUIT TEMPERATURE CINQ ENTRE ENTRE DOUZE ENTRE,"cette nuit, températures entre cinq et douze degrés"
COMMENT-APPARAITRE EN-VENANT SAMEDI REGION BEAUCOUP DE SOLEIL MAXIMUM NEUF VINGT DEGRES DIMANCHE AUSSI GENERALEMENT SOLEIL,les perspectives samedi beaucoup de soleil partout jusqu'à vingt-neuf degrés aussi dimanche le soleil brille encore la plupart du temps
LUNDI CHANGEANT PARFOIS SOLEIL NUAGE AVERSES ORAGE FORT ORAGE POSSIBLE,"le lundi, le temps sera plus variable, avec du soleil et des nuages, des averses et des orages qui peuvent être violents."
CHER SPECTATEUR BON SOIR,"Chers téléspectateurs, bonsoir"
CET ETE CET ETE ACTUEL VACANCES ETE MAIS EN PROGRAMMATION SUEDWEST VENANT PLUS CHAUD LE SUEDE DIMANCHE PAYS DE L'ALLEMAGNE INFORMATION DE VINGT A NEUF DIFFERENCES NORD FROID COMME SUED PLUS CHAUD,"Même si l'été ne mérite pas vraiment son nom, il fera un peu plus chaud chaque jour dans les prochains jours à partir du sud-ouest, de sorte que dimanche, nous serons à nouveau entre vingt et vingt-neuf degrés en Allemagne, avec un peu plus de fraîcheur dans le nord que dans le sud."
CETTE NUIT POURTANT-AUTREMENT-AVERSES SURTOUT VENT DU NORD AUSSI GENERALEMENT SUD AVERSES DEJA DISPARUES,"ce soir, il y a encore quelques averses, surtout dans le nord, et le vent est encore assez fort, alors que dans le sud, les averses se font de plus en plus rares."
DEMAIN RESTE PARTICULIEREMENT IX VENT GENERALEMENT NORD,"et demain, il y aura toujours du vent, principalement sur les côtes, mais parfois aussi des vents forts dans le nord de l'Allemagne."
DEBUT AVERSES RARES APRES MIDI PLUIE VENIR PLUIE IX AGREABLE IX NORD COTE ET CŒUR MONTAGNE IX,"au début, les averses sont plutôt rares, mais dans l'après-midi, la pluie s'invite et avant la pluie, le temps reste le plus longtemps agréable et sec entre la mer Baltique et les monts Métallifères."
SUD-EST AVERSES AUSSI SINON REGION PLUS AGREABLE PARTIE AUSSI B,"dans le sud-est aussi, il y aura encore des averses demain, mais sinon le temps sera nettement plus agréable en direction du sud-ouest, parfois même assez ensoleillé comme dans le Brisgau"
IX TEMPERATURE PEUT VOIR VINGT A UN VINGT DEGRES C'ETAIT LA REGION EN DESSOUS DE VINGT,et cela se voit à la température qui atteint vingt à vingt et un degrés alors que nous restons habituellement en dessous de la barre des vingt degrés.
SUD AGREABLE AU COURS AU COURS RESTER BEAUCOUP DE SOLEIL CENTRE NORD PLUS DE NUAGES MAIS PLUIE DISPARAITRE LENTEMENT,"le temps agréable se poursuivra dans les prochains jours au sud, ce qui signifie beaucoup de soleil au centre et plus de nuages au nord, mais au moins la pluie s'estompe progressivement"
PLUS CHAUD ALORS BONHEUR POUR TOUS,et il fait heureusement nettement plus chaud pour tout le monde
BONNE soirée poss-EUCH,C'est tout pour la météo. Bonne soirée.
MAINTENANT COMMENT-APPARAITRE DEMAIN TEMPS MERCREDI SEPT JUIN,et maintenant les prévisions météo pour demain mercredi 7 juillet
SI PLUIE A ETE IX POSSIBLE BROUILLARD,"là où il a plu, du brouillard peut se former par endroits"
DEMAIN IX BLEU CIEL SOLEIL SURTOUT MER IX PROBABLEMENT UN PEU NUAGEUX,"demain, un ciel bleu et ensoleillé nous attend sur une grande partie du territoire - quelques nuages convectoriels apparaîtront temporairement au-dessus des montagnes"
CENTRE MONTAGNE VALLEE CETTE NUIT MOINS DE DIX NORD MAXIMUM QUATORZE DEGRES,"dans certaines vallées de moyenne montagne, cette nuit seulement des valeurs à un chiffre à la mer orientale jusqu'à quatorze degrés"
IX DEMAIN VINGT SINON REGION UN VINGT HUIT VINGT MAXIMUM B HUIT TRENTE DEGRES,là demain à vingt sinon vingt et un à vingt-huit dans le brisgau à trente degrés
JEUDI AUSSI SOLEIL PROBABLEMENT UN PEU DE NUAGES NORD MAIS SEC,"jeudi également généralement ensoleillé sur la mer du nord, parfois nuageux mais toujours sec"
VENDREDI PLUS,"vendredi et samedi, il fera encore plus chaud"
SOLEIL SURTOUT NORD-OUEST SI JOURNEE EN COURS VIOLENT ORAGE,"le soleil brille généralement, en particulier dans la moitié nord-ouest du pays, où des orages de chaleur parfois violents peuvent éclater au cours de la journée"
DEMAIN TEMPS COMMENT-APPARAITRE MERCREDI SIX JANVIER,et maintenant les prévisions météo pour demain mercredi 6 janvier
RESTER FROID FROID VENIR,l'air froid détermine le temps en allemagne
NORD FRANCE SUEDOST EUROPE PROFONDE BEAUCOUP D'INFLUENCE NEG,"Les dépressions sur la mer du Nord, la France et le sud-est de l'Europe ne sont que marginales"
NORD-OUEST SUD NEIGE PLUS FORT SEC,"un peu de neige est possible, en particulier dans le nord-ouest et le sud, mais le temps reste généralement sec"
NORD-OUEST VENT FRAIS MONTRER-ECRAN LOURD TOURBILLON,"en mer du nord, vent frais de sud à sud-est, sinon vent faible de différentes directions"
JOUR TEMPERATURE MONTER MOINS ONZE A MOINS UN,"dans la journée, les températures montent jusqu'à moins onze ou moins un degré"
JEUDI NORD NEIGE VENDREDI SUD-EST PLUIE FORTE,"jeudi, quelques chutes de neige dans le nord de l'allemagne vendredi, chutes de neige parfois importantes dans la moitié sud-est avec les perturbations de trafic que cela implique"
VENT FORT C'EST POURQUOI NEIGE MONTAGNE VENT DE NEIGE,"le vent étant très fort, il faut s'attendre à des chutes de neige, surtout en montagne."
SAMEDI REGION BEAUCOUP DE NEIGE,"samedi, il neigera sur une grande partie du pays"
BON SOIR CHER SPECTATEUR,bonsoir chers spectateurs
PLUIE AUJOURD'HUI DERNIER NORD MER MAINTENANT ENTRENT SEULEMENT NEIGE MILIEU MONTAGNE DEJA NEIGE ET DEJA,"Les dernières averses ont eu lieu aujourd'hui sur la mer du Nord. Désormais, il n'y aura plus que de la neige, ce qui était également le cas aujourd'hui en moyenne montagne."
QUELQUES C+M NOUVELLE NEIGE,il y a déjà quelques centimètres de neige fraîche
POUR LE MOMENT CHAUD SUD TURQUIE IX AUSSI Z+Y+P GRECQUE K GRECQUE VINGT DEGRES,les plus chauds actuellement dans le sud de la turquie à chypre et aussi en partie en crète en grèce jusqu'à vingt degrés tout de même
PUIS GELEE CETTE NUIT OUI SURTOUT SUD CENTRE MONTAGNE ET COTE,"et nous avons le gel cette nuit, surtout dans le sud, dans les moyennes montagnes et aussi sur les côtes"
ENTRE ZONE UN PEU PLUS DOUX ZERO ENTRE MAIS CONTINUE ENORMEMENT GLISSANT,"entre-temps, il fait un peu plus doux, autour de zéro degré, mais le temps sera encore très glissant"
BEAUCOUP DE NEIGE ARRIVENT SURTOUT OUEST NOIR FORET REGION MONTAGNE AUSSI E+R+Z MONTAGNE IX AUSSI UN PEU DE NEIGE,plusieurs averses de neige sont en cours et continuent à se déplacer ici dans l'ouest en direction de la forêt noire et des Alpes il neigera encore un peu dans les monts Métallifères
MATIN EGALEMENT NEIGE MAIS BEAUCOUP DE NEGAL PARTIELLEMENT MONTAGNE ET E+R+Z MONTAGNE,"et demain encore un peu de neige, mais pas en grande quantité, surtout en bordure des Alpes et dans les monts Métallifères."
SINON REGION FORTEMENT NUAGEUSE MAIS COTE BELLE AIR SEC EN PLUS UN PEU FROID VENT FRAIS DU NORD,"le reste du temps est généralement très nuageux, mais sur les côtes, le soleil brille dans cet air sec et ce vent du nord un peu froid."
DONC TEMPERATURE SCHLESWIG HOLSTEIN IX SEULEMENT AU-DESSUS DE ZERO NEG-ONT PASSE LE GEL AU MONT IX,et c'est ainsi que les températures ne dépassent pas zéro degré dans le Schleswig Holstein et qu'il gèle en permanence au bord des Alpes.
SINON RESTE DE LA REGION UN PEU AU-DESSUS DE ZERO DEGRE UN PEU ENTRE,sinon un peu au-dessus de zéro degré
PARAIRE JOUR DE PLUS FROID EN PARTICULIER EST ET SUEDE ET NEG-IMMER VONT NEIGER,et il fera encore plus froid dans les prochains jours cela concerne surtout l'est et le sud de l'Allemagne et il y aura toujours de la neige
BASSE REGION DONC LES PLUIES ARRIVENT,la dépression au-dessus de l'atlantique alimente une grande partie de l'allemagne en nouveaux nuages de pluie
HAUT FINNOIS VIENNENT MAIS INFLUENCE EST,l'anticyclone au-dessus de la Finlande se retire quelque peu mais continue à déterminer le temps dans l'est de l'Allemagne
AIR SOUFFLENT PLUS DOUX,l'air qui s'écoule vers nous est de plus en plus doux
NORD-EST NUIT CLAIR REGION PLUIE,"dans le nord-est, la nuit est souvent claire sinon il pleut ici et là"
JOUR NORD CŒUR ESPACE AIMABLE REGION NUAGE FOIS PLUIE,"en journée, entre la mer Baltique et les monts Métallifères, temps assez agréable sinon beaucoup de nuages et de la pluie à certains endroits"
PLUS TARD OUEST VENIR ECLAIRCIR,"plus tard, le ciel se dégage partiellement dans l'ouest et le sud-ouest"
NORD MODERE IX NORD FORT VENT,"au nord, vent modéré à frais en mer, vent fort avec rafales de vent"
REGION VENT FAIBLE,sinon à nouveau faible à modéré
DIMANCHE SUD-EST AGREABLE NORD-EST PLUS DE NUAGES,"dimanche, le temps est agréable dans le sud-est et plus nuageux vers le nord-est"
DEMAIN TEMPS COMMENT-APPARAITRE VENDREDI PREMIER FEVRIER,et maintenant les prévisions météo pour demain vendredi 1er février
MER BASSE VENIR MILIEU MONTAGNE NOUVELLE PLUIE NEIGE POUVOIR,La dépression qui se déplace de l'Atlantique vers l'Europe centrale détermine notre temps avec de nouvelles pluies et de nouvelles chutes de neige.
APRES-MIDI LONG PLUIE PEUVENT IX PLUIE PARTIELLEMENT OUEST VENIR,"en journée, il pleut parfois longtemps et même abondamment dans certaines régions ; la pluie s'étend du sud-ouest et de l'ouest à une grande partie du pays"
MAXIMUM VENT VENTS SUD VENT OURAGAN MONTAGNE LOURDE TEMPETE POUVOIR,"le vent est modéré à frais dans le nord-est ainsi que dans la moitié sud, des rafales de vent sont possibles sur les montagnes."
CETTE NUIT REGION HUIT DEGRES REGION CŒUR REGION UN DEGRE,"dans la nuit, huit degrés dans le Rhin supérieur et un degré en direction de l'Erzgebirge"
SAMEDI IX NEIGE PLAT NEIGE,"samedi, il neigera dans certaines régions en plaine, il pleuvra par endroits"
